<?xml version="1.0" encoding="UTF-8"?>
<!--

    ***************************************************************************
    Copyright (c) 2010 Qcadoo Limited
    Project: Qcadoo Framework
    Version: 1.4

    This file is part of Qcadoo.

    Qcadoo is free software; you can redistribute it and/or modify
    it under the terms of the GNU Affero General Public License as published
    by the Free Software Foundation; either version 3 of the License,
    or (at your option) any later version.

    This program is distributed in the hope that it will be useful,
    but WITHOUT ANY WARRANTY; without even the implied warranty
    of MERCHANTABILITY or FITNESS FOR A PARTICULAR PURPOSE.
    See the GNU Affero General Public License for more details.

    You should have received a copy of the GNU Affero General Public License
    along with this program; if not, write to the Free Software
    Foundation, Inc., 51 Franklin St, Fifth Floor, Boston, MA  02110-1301  USA
    ***************************************************************************

-->
<plugin plugin="qcadooUnitConversions" group="framework" version="${qcadoo.plugin.version}"
		xmlns:security="http://schema.qcadoo.org/modules/security"
	xmlns:xsi="http://www.w3.org/2001/XMLSchema-instance" xmlns="http://schema.qcadoo.org/plugin"
	xmlns:model="http://schema.qcadoo.org/modules/model" xmlns:view="http://schema.qcadoo.org/modules/view"
	xmlns:menu="http://schema.qcadoo.org/modules/menu" xmlns:localization="http://schema.qcadoo.org/modules/localization"
	xsi:schemaLocation="
		http://schema.qcadoo.org/plugin 
		http://schema.qcadoo.org/plugin.xsd 
		http://schema.qcadoo.org/modules/model 
		http://schema.qcadoo.org/modules/model.xsd 
		http://schema.qcadoo.org/modules/view 
		http://schema.qcadoo.org/modules/view.xsd 
		http://schema.qcadoo.org/modules/localization 
		http://schema.qcadoo.org/modules/localization.xsd
		http://schema.qcadoo.org/modules/security
		http://schema.qcadoo.org/modules/security.xsd
		http://schema.qcadoo.org/modules/menu 
		http://schema.qcadoo.org/modules/menu.xsd">

	<information>
		<name>Qcadoo Unit Conversion Management</name>
		<vendor>
			<name>Qcadoo Limited</name>
			<url>http://www.qcadoo.com/</url>
		</vendor>
		<description>Provides views of management conversions (like qcadooDictionaries). Implementation of conversions (like the dictionary) is in qcadooModel.</description>
		<license>AGPL</license>
	</information>

	<dependencies>
		<dependency>
			<plugin>qcadooView</plugin>
			<version>[1.1.8</version>
		</dependency>
		<dependency>
			<plugin>qcadooDictionaries</plugin>
			<version>[1.1.8</version>
		</dependency>
	</dependencies>

	<modules>
		<localization:translation path="locales" />

		<security:role identifier="ROLE_UNIT_CONVERSIONS"/>

		<menu:menu-item-url name="unitConversions"
			category="administration" url="/unitConversions.html" defaultAuthorizationRole="ROLE_UNIT_CONVERSIONS"/>

		<view:view resource="view/unitConversions.xml" />
	</modules>
	
	<features>
		<dev-library />
	</features>

</plugin>