<?xml version="1.0" encoding="UTF-8"?>
<!--

    ***************************************************************************
    Copyright (c) 2010 Qcadoo Limited
    Project: Qcadoo Framework
    Version: 1.4

    This file is part of Qcadoo.

    Qcadoo is free software; you can redistribute it and/or modify
    it under the terms of the GNU Affero General Public License as published
    by the Free Software Foundation; either version 3 of the License,
    or (at your option) any later version.

    This program is distributed in the hope that it will be useful,
    but WITHOUT ANY WARRANTY; without even the implied warranty
    of MERCHANTABILITY or FITNESS FOR A PARTICULAR PURPOSE.
    See the GNU Affero General Public License for more details.

    You should have received a copy of the GNU Affero General Public License
    along with this program; if not, write to the Free Software
    Foundation, Inc., 51 Franklin St, Fifth Floor, Boston, MA  02110-1301  USA
    ***************************************************************************

-->
<plugin plugin="qcadooPlugin" group="framework" version="${qcadoo.plugin.version}"
	system="true" xmlns:xsi="http://www.w3.org/2001/XMLSchema-instance"
	xmlns="http://schema.qcadoo.org/plugin" xmlns:model="http://schema.qcadoo.org/modules/model"
	xmlns:view="http://schema.qcadoo.org/modules/view"
	xsi:schemaLocation="
		http://schema.qcadoo.org/plugin 
		http://schema.qcadoo.org/plugin.xsd 
		http://schema.qcadoo.org/modules/model 
		http://schema.qcadoo.org/modules/model.xsd 
		http://schema.qcadoo.org/modules/view 
		http://schema.qcadoo.org/modules/view.xsd">

	<information>
		<name>Qcadoo Framework Plugin</name>
		<vendor>
			<name>Qcadoo Limited</name>
			<url>http://www.qcadoo.com/</url>
		</vendor>
		<description>System plugin which provided functionality to manage plugins state flow and every operations connected with this functionality.</description>
		<license>AGPL</license>
	</information>

	<modules>
		<model:model model="plugin" resource="model/plugin.xml" />
	</modules>
	
	<features>
		<dev-library />
	</features>

</plugin>